user,assistant
Really ? Are you sure ?,Yeah ! Why not ? They are trendy and look great ! I want to get a dragon on my arm or maybe a tiger on my back .
Yeah ! Why not ? They are trendy and look great ! I want to get a dragon on my arm or maybe a tiger on my back .,"Yeah but , it is something that you will have forever ! They use indelible ink that can only be removed with laser treatment . On top of all that , I have heard it hurts a lot !"
"Yeah but , it is something that you will have forever ! They use indelible ink that can only be removed with laser treatment . On top of all that , I have heard it hurts a lot !",Really ?
Really ?,Of course ! They use this machine with a needle that pokes your skin and inserts the ink .
Of course ! They use this machine with a needle that pokes your skin and inserts the ink .,"Oh , I didn ’ t know that ! I thought they just paint it on your skin or something ."
"Oh , I didn ’ t know that ! I thought they just paint it on your skin or something .","I think you should reconsider and do some more research about tattoos . Also , find out where the nearest tattoo parlor is and make sure they used sterilized needles , and that the place is hygienic ."
"I think you should reconsider and do some more research about tattoos . Also , find out where the nearest tattoo parlor is and make sure they used sterilized needles , and that the place is hygienic .",Maybe I should just get a tongue piercing !
"s the screen near your steering wheel for ? 
  It","s a popular thing now . 
  Oh , that"
"s a popular thing now . 
  Oh , that",s on everyday ?
"Oh , no !",How dreadful !
How dreadful !,Look at the view from the window .
Look at the view from the window .,"Oh , dear . That ’ s terrible . Not at all what I expected ."
"Oh , dear . That ’ s terrible . Not at all what I expected .","It ’ s awful , isn ’ t it ?"
"It ’ s awful , isn ’ t it ?",I can ’ t bear to look at it . I ’ m rather disappointed .
I can ’ t bear to look at it . I ’ m rather disappointed .,It can ’ t be helped .
"What do you do in your free time , Nancy ?","Well , I like playing the violin ."
"Well , I like playing the violin .",Really ? How long have you been playing the violin ?
Really ? How long have you been playing the violin ?,About ten years so far . I started learning when I was in middle school .
About ten years so far . I started learning when I was in middle school .,s really interesting .
s really interesting .,"Well , I like collecting matchbox ! I"
"Well , I like collecting matchbox ! I",Of course it does . Everybody has his own hobby .
How can I tell her about this ?,"t worry , you"
"t worry , you",There is no need to be so frustrated .
There is no need to be so frustrated .,How can you live without job in the future ?
How can you live without job in the future ?,"t worry , you"
What sports do you like to play ?,I like baseball and basketball .
I like baseball and basketball .,How about football ?
How about football ?,"In my country football is brand new , so I never learned the game when I was younger ."
"In my country football is brand new , so I never learned the game when I was younger .",s a very popular game in America .
s a very popular game in America .,"For me , it"
"For me , it",Are you a football player ?
Are you a football player ?,re too old to play tackle football .
I see . It,"re welcome to join us . 
  I"
"re welcome to join us . 
  I","s go down together . 
  Ok . I"
"s go down together . 
  Ok . I",Great .
What upsets you ?,"My parents called . As usual , they reminded me again that I should have a plan to marry by my late 20s . Easier said then done . Who should I marry ? I have no time to go on a date ."
"My parents called . As usual , they reminded me again that I should have a plan to marry by my late 20s . Easier said then done . Who should I marry ? I have no time to go on a date .",It is not your mother finding one for you ?
It is not your mother finding one for you ?,"I will find one myself , of course . I ’ m a modern girl ."
"I will find one myself , of course . I ’ m a modern girl .","Perhaps you can try the three minutes date , the latest type ."
"Perhaps you can try the three minutes date , the latest type .","You mean dozens of the opposite sex meet each other for three minutes in a dimly bar serving alcohol , I hate that idea ."
"You mean dozens of the opposite sex meet each other for three minutes in a dimly bar serving alcohol , I hate that idea .","No , there is an updated virgin , three minutes video date . I know an online dating website providing such service with a microphone and webcam , you can sigh for it . You can be face-to-face with a guy talking for maximum three minutes ."
"No , there is an updated virgin , three minutes video date . I know an online dating website providing such service with a microphone and webcam , you can sigh for it . You can be face-to-face with a guy talking for maximum three minutes .",I don ’ t think it makes sense . Three minutes is such a short time .
I don ’ t think it makes sense . Three minutes is such a short time .,"I think you can find out if there is a possibility of romance within the first second of meeting someone , so-called love at first sight ."
"I think you can find out if there is a possibility of romance within the first second of meeting someone , so-called love at first sight .","Anyway , I don ’ t want to post my face up for sale on the internet like that ."
"Anyway , I don ’ t want to post my face up for sale on the internet like that .","Don ’ t worry . There are many other options using the internet as dating methods . Some sites operate at international standard even have got certifications . Of course , for these sites , you have to pay a membership fee . But all in all , it is more serious and professional . The chance of meeting a good and serious person who does not play games is higher ."
"Don ’ t worry . There are many other options using the internet as dating methods . Some sites operate at international standard even have got certifications . Of course , for these sites , you have to pay a membership fee . But all in all , it is more serious and professional . The chance of meeting a good and serious person who does not play games is higher .",I don ’ t want to post my personal information on the internet . I ’ m not knowing who is reading it .
Are you going to the party on Saturday ?,I was thinking about it . Are you ?
I was thinking about it . Are you ?,s going to be a lot of fun .
How do you know it,"This party is going to have a DJ , food , and drinks ."
"This party is going to have a DJ , food , and drinks .",s going to be fun .
Could you talk to me for a few minutes about my grades ?,Step into my office for a moment . What is your concern ?
Step into my office for a moment . What is your concern ?,Am I failing ?
Am I failing ?,s go on the computer to see what
s go on the computer to see what,I am pretty sure that I am in trouble .
I am pretty sure that I am in trouble .,"I can see that you are trying , but where do you think you could improve ?"
"I can see that you are trying , but where do you think you could improve ?",I missed a few classes ; I need to make sure I come to school on a regular basis .
I missed a few classes ; I need to make sure I come to school on a regular basis .,"Having a regular study routine and following it is very important , right ?"
"Having a regular study routine and following it is very important , right ?",ll try ; it
ll try ; it,Thanks for stopping by !
So he said he,s a brick ?
"t you open the box ? 
  I wanted to . But he said , no , the box is still in its plastic wrap from the store.If it",t believe it
t believe it,So he had the boxes wrapped in plastic .
So he had the boxes wrapped in plastic .,"Yes , it was the kind of perfect plastic wrap that comes with new products.Look , it even had a bar-code price sticker on it ! It looked brand new ."
"Yes , it was the kind of perfect plastic wrap that comes with new products.Look , it even had a bar-code price sticker on it ! It looked brand new .",But why would a guy be selling new video cameras for twenty dollars ?
But why would a guy be selling new video cameras for twenty dollars ?,He said he had to get rid of them . They were stolen .
He said he had to get rid of them . They were stolen .,"Aha ! Now I understand.You were trying to buy stolen goods on the sidewalk.So , what I think is , you deserve to get cheated !"
"Aha ! Now I understand.You were trying to buy stolen goods on the sidewalk.So , what I think is , you deserve to get cheated !","mon , don"
"mon , don","t understand how he could have such a perfect-looking box . 
  That"
"t understand how he could have such a perfect-looking box . 
  That",s easy.And probably it
s easy.And probably it,"s a good profit if they can sell enough bricks . 
  You"
Is the clock right ?,m afraid it gains a little .
s up ?,"Oh , that"
"Oh , that","t think so at first . But as we started talking , I found him extremely funny and witty . I couldn"
"t think so at first . But as we started talking , I found him extremely funny and witty . I couldn",It seems you two are a good match . What qualities do you look for in a friend ?
It seems you two are a good match . What qualities do you look for in a friend ?,s nothing definite I think . I don
s nothing definite I think . I don,s something I
s something I,"t expect a close relationship with a dishonest person . Those are the people that will turn their back on you when you are in need . 
  Yeah , I know . A friend in need is a friend indeed . I don"
What ’ s up ? You don ’ t look too good .,"Yeah , my head hurts , that ’ s all . I ’ Ve been in physics class all day . It ’ s killer !"
"Yeah , my head hurts , that ’ s all . I ’ Ve been in physics class all day . It ’ s killer !","I liked physics . It ’ s all math , really . arcs , curves , velocity , cool stuff ."
"I liked physics . It ’ s all math , really . arcs , curves , velocity , cool stuff .","Yeah , yeah , but today ’ s lesson was all about the creation of the universe ."
"Yeah , yeah , but today ’ s lesson was all about the creation of the universe .",A physics class about the creation of the universe ? That ’ s some pretty unscientific language there . Sounds more religious to me .
A physics class about the creation of the universe ? That ’ s some pretty unscientific language there . Sounds more religious to me .,It ’ s all religion . Take the theory of the Big Bang.How is it possible that all of the stuff in the universe comes from an explosion ? That ’ s no better than Atlas carrying the globe on his back or African myths about turtles and stuff .
It ’ s all religion . Take the theory of the Big Bang.How is it possible that all of the stuff in the universe comes from an explosion ? That ’ s no better than Atlas carrying the globe on his back or African myths about turtles and stuff .,"Turtles ? Whatever ... Look , all that ’ s required for the creation of matter an imbalance of particles and anti-particles . At least , that ’ s what the math says ."
"Turtles ? Whatever ... Look , all that ’ s required for the creation of matter an imbalance of particles and anti-particles . At least , that ’ s what the math says .","Math , sheath . What ’ s the evidence ?"
"Math , sheath . What ’ s the evidence ?","There is evidence ! You know Edwin Hubble ? He ’ s the guy who in the early twentieth century was the first scientist to measure the drift of matter in the universe , thus advancing notions of an expanding universe . What would it be expanding from ? Well , the Big Bang ... DUH !"
"There is evidence ! You know Edwin Hubble ? He ’ s the guy who in the early twentieth century was the first scientist to measure the drift of matter in the universe , thus advancing notions of an expanding universe . What would it be expanding from ? Well , the Big Bang ... DUH !","Anyway , it ’ s just a theory . Why do people go around touting theories ? Where ’ s the scientific rigor in that ?"
"Anyway , it ’ s just a theory . Why do people go around touting theories ? Where ’ s the scientific rigor in that ?","Dude , don ’ t equivocate . A theory only becomes a theory after withstanding rigorous testing . You slept through class , didn ’ t you ?"
Today more and more people advocate lifelong learning . But people have different views about lifelong learning . How do you understand lifelong learning ?,s never too soon or too late for learning
"s about your attitude towards learning . One should be open to new ideas , decisions , skills or behaviors . 
  Then the axiom -",t teach an old dog new tricks
t teach an old dog new tricks,"t work any longer . 
  You"
"t work any longer . 
  You","Yes , I agree with you . When I retired I will participate in programs to keep momentally active ."
"Yes , I agree with you . When I retired I will participate in programs to keep momentally active .","Me too . To keep up with the changing world , one must be involved in lifelong learning and be ready to accept new things ."
"Me too . To keep up with the changing world , one must be involved in lifelong learning and be ready to accept new things .","ve recently been teaching myself French . 
  Really ? That"
"ve recently been teaching myself French . 
  Really ? That","Yes , so I want to learn French to develop my career ."
How old are you ?,"ll be ten on May 1st.When is your birthday ? 
  I"
"ll be ten on May 1st.When is your birthday ? 
  I",ll be ten on April 14th .
ll be ten on April 14th .,Maybe . I
It smells like an ashtray in here !,Hi honey ! What ’ s wrong ? Why do you have that look on your face ?
Hi honey ! What ’ s wrong ? Why do you have that look on your face ?,What ’ s wrong ? I thought we agreed that you were gonna quit smoking .
What ’ s wrong ? I thought we agreed that you were gonna quit smoking .,No ! I said I was going to cut down which is very different . You can ’ t just expect me to go cold turkey overnight !
No ! I said I was going to cut down which is very different . You can ’ t just expect me to go cold turkey overnight !,"Look , there are other ways to quit . You can try the nicotine patch , or nicotine chewing gum . We spend a fortune on cigarettes every month and now laws are cracking down and not allowing smoking in any public place . It ’ s not like you can just light up like before ."
"Look , there are other ways to quit . You can try the nicotine patch , or nicotine chewing gum . We spend a fortune on cigarettes every month and now laws are cracking down and not allowing smoking in any public place . It ’ s not like you can just light up like before .","I know , I know . I am trying but , I don ’ t have the willpower to just quit . I can ’ t fight with the urge to reach for my pack of smokes in the morning with coffee or after lunch ! Please understand ?"
"I know , I know . I am trying but , I don ’ t have the willpower to just quit . I can ’ t fight with the urge to reach for my pack of smokes in the morning with coffee or after lunch ! Please understand ?",Fine ! I want a divorce !
It seems that you get antsy when you hear I praise another guy .,"I get antsy not because you praise a guy , but because you may be taken for a ride by a guy like him ."
"I get antsy not because you praise a guy , but because you may be taken for a ride by a guy like him .",How come you think of him that way ?
How come you think of him that way ?,Because you seem to have lost your vigilance . You should be on the watch out .
Because you seem to have lost your vigilance . You should be on the watch out .,"s never caused any harm . 
  Isn"
"s never caused any harm . 
  Isn","s an all-right guy . 
  All-right guy ? All right . Let"
Cheese ! It tastes like cardboard .,I think so . Maybe that ’ s why it ’ s cheap here .
Have you signed up to join the company ’ s Christmas party ?,"Sure , I have . Will you join ?"
"Sure , I have . Will you join ?","I will . You know , as a newcomer , I think it might be a good opportunity to get to know people from the other departments of our company in a more relaxed atmosphere ."
"I will . You know , as a newcomer , I think it might be a good opportunity to get to know people from the other departments of our company in a more relaxed atmosphere .",You are right . Our company ’ s Christmas party has always been an amazing occasion for everybody to relax and get to know each other better . It is also a time to make new friends and do some networking .
You are right . Our company ’ s Christmas party has always been an amazing occasion for everybody to relax and get to know each other better . It is also a time to make new friends and do some networking .,I hope that it is not a formal one when the boss is there .
I hope that it is not a formal one when the boss is there .,"No , it will not be formal at all . It is a fun time . You will love the game show . Please dress casually . Usually there is an over abandon of drinks , so be careful with that ."
"No , it will not be formal at all . It is a fun time . You will love the game show . Please dress casually . Usually there is an over abandon of drinks , so be careful with that .","Don ’ t worry , I can handle that . And I know if the boss is there , even it is an informal evening , it does not make a good impression to get totally drunk in front of him ."
"hi , Emily , do you know that guy over there ?","s Drive , he works with Lily ."
"t ring me last night . You said you would . 
  I",s all right . But why were you so rude to me at lunch .
"Hi , Nicole . Did you have a good weekend ?","Yes , I did . But I feel tired today ."
"Yes , I did . But I feel tired today .",Really ? Why ?
Really ? Why ?,"Well , on Saturday I cleaned the house and played tennis . Then on Sunday I hiked in the country ."
"Well , on Saturday I cleaned the house and played tennis . Then on Sunday I hiked in the country .","And I bet you studied , too ."
"And I bet you studied , too .",Yeah . I studied on Sunday evening . What about you ?
Yeah . I studied on Sunday evening . What about you ?,t clean the house and I didn
t clean the house and I didn,"That sounds like fun , but did you exercise ?"
"That sounds like fun , but did you exercise ?",Sort of . I played golf on my computer !
There will be a parade to celebrate National Day this weekend .,s the route ?
m afraid you,ve moved my books .
"Oh , well , I looked around . There wasn",m sorry if I
What ’ s the life expectancy in your country ?,"I ’ m not sure , but probably about 75 years . How about in your country ?"
"I ’ m not sure , but probably about 75 years . How about in your country ?","About 70 , I think . This newspaper article talks about the problems of an aging population . It ’ s a problem that will soon affect most of the world ."
"About 70 , I think . This newspaper article talks about the problems of an aging population . It ’ s a problem that will soon affect most of the world .","I heard that the government might need to increase the retirement age , because otherwise there will not be enough workers to support the young and the elderly ."
"I heard that the government might need to increase the retirement age , because otherwise there will not be enough workers to support the young and the elderly .",Perhaps we need to have more babies ! Tina gave birth to a baby boy yesterday .
Perhaps we need to have more babies ! Tina gave birth to a baby boy yesterday .,"Did she ? That ’ s great . However , if we have too many children , that will have a bad effect on the enviroment ."
"Did she ? That ’ s great . However , if we have too many children , that will have a bad effect on the enviroment .",How ’ s your son these days ?
How ’ s your son these days ?,"Oh , he ’ s fine . Kids seem to grow up very quickly nowadays ."
"Oh , he ’ s fine . Kids seem to grow up very quickly nowadays .",He ’ ll be a teenager before you know it ! Teenagers are often rebellious ! When do you mine it is a good age to have a child ?
He ’ ll be a teenager before you know it ! Teenagers are often rebellious ! When do you mine it is a good age to have a child ?,"I had mine when I was 24 . that ’ s a little young . I ’ d suggest you wait until you are in your late twenties . , or even in your early thirties if you have a good career ."
"I had mine when I was 24 . that ’ s a little young . I ’ d suggest you wait until you are in your late twenties . , or even in your early thirties if you have a good career .","Yes , I think you ’ re right . I ’ m thinking about having a child , but not just yet ."
"Yes , I think you ’ re right . I ’ m thinking about having a child , but not just yet .",Is there a big generation gap between parents and their children in you country ?
Is there a big generation gap between parents and their children in you country ?,"Yes , there is . Teenagers do not want to live traditional lives . They want to go out , have fun , and explore the world . They want to develop their own view of life . Parents usually try to discourage them , but they don ’ t often succeed ."
"Yes , there is . Teenagers do not want to live traditional lives . They want to go out , have fun , and explore the world . They want to develop their own view of life . Parents usually try to discourage them , but they don ’ t often succeed .",Parents usually give their children more freedom in my country . Sometimes they give them too much freedom .
Parents usually give their children more freedom in my country . Sometimes they give them too much freedom .,"It ’ s almost impossible to get the right balance . If you are too strict , kids might ignore you . If you are too lenient , they might go wild ."
m going to Japan this year on vacation .,"No , but I"
"Hey , Mark , long time no see .","s good to see you again . How have you been ? 
  Great . I just got back from a week"
"s good to see you again . How have you been ? 
  Great . I just got back from a week",Really ? How was it ?
Really ? How was it ?,t want to come back .
Not much . I,I know what you mean . I could use a vacation myself .
I know what you mean . I could use a vacation myself .,t it be great if we could go to Thailand together sometime ?
Could I see the manager please ? I have a complaint to make .,"Yes , I ’ m the manager here . What can I do for you , Madam ?"
"Yes , I ’ m the manager here . What can I do for you , Madam ?",Did you have the room checked before we move in ?
Did you have the room checked before we move in ?,Which room are you in ?
Which room are you in ?,"1808 . The toilet doesn ’ t work properly , the water doesn ’ t run in the shower ."
"1808 . The toilet doesn ’ t work properly , the water doesn ’ t run in the shower .",I ’ m awfully sorry to hear that . I ’ ll turn to it right away .
"Congratulations , Vivian . You won the grand prize , again .",t it just great ! I just knew I
t it just great ! I just knew I,You did ? How ? Did you wear red underwear again this year ?
You did ? How ? Did you wear red underwear again this year ?,Not only that !
Not only that !,"s your secret ? ! 
  OK , OK . I"
"s your secret ? ! 
  OK , OK . I",What ? ! You did that ? ? ! ! !
We are going to the concert this evening . Will you join us .,m very sorry I can
m very sorry I can,Why not ?
"v been work here for nearly a month , how do you feel about the job ?","I had the same feeling when I first came to work here . but after a period of time , I feel better , I am sure you"
"I had the same feeling when I first came to work here . but after a period of time , I feel better , I am sure you",s really wonderful !
The music is on.May I have the pleasure to dance with you ?,m engaged for the foxtrot.Will the next Walls be all right ?
"Excuse me , is this seat taken ?","No , please feel free ."
"No , please feel free .",Thanks a lot .
Thanks a lot .,Do you work in Shanghai ?
Do you work in Shanghai ?,Yes I do . How about you ?
Yes I do . How about you ?,m a tourist . This place is amazing ! It
m a tourist . This place is amazing ! It,"s so much to see here . 
  You can say that again ! It"
"s so much to see here . 
  You can say that again ! It",s see ... I
s see ... I,s for sure !
"Look at this headline , Soo Mi .",Wow ! So many people in the United States get divorced !
Wow ! So many people in the United States get divorced !,Is it the same in Korea ?
Is it the same in Korea ?,"t think so . In Korea some marriages break up , but most couples stay together ."
Boy ! What a beauty ! I fall in love with her at the first sight .,The beauty under the tree ?
The beauty under the tree ?,Of course.No girl is more charming .
Of course.No girl is more charming .,She is a young man !
Excuse me.Where do I register ?,"Oh , over there in Pacific Pavilion ."
"Oh , over there in Pacific Pavilion .","Is that the large , white building ?"
"Is that the large , white building ?",s it .
How was your education going on in Australia ?,m going to graduate this summer .
Why are you choosing to leave a foreign country ? Many people are reluctant to leave the superior living environment abroad .,"Well , I think personal development is much more important than simply having a superior living environment ."
"Do you have any particular hobbies , Tom ?","Oh , yes . I love playing badminton , table tennis and computer games . And playing the games has become my favorite ."
"Oh , yes . I love playing badminton , table tennis and computer games . And playing the games has become my favorite .","t care about their own health at all . How about you ? 
  I"
"t care about their own health at all . How about you ? 
  I","s mindless to sit in front of a machine all the time , but I think it"
