user,assistant
Sounds good . When and where shall we meet ?,Let me see . How about 6:30 at the gate of the club ?
Let me see . How about 6:30 at the gate of the club ?,"Fine , see you then ."
Are there many idioms in English ?,There are hundreds and hundreds.English is particularly rich in idiomatic expressions .
There are hundreds and hundreds.English is particularly rich in idiomatic expressions .,Can you give us an example ?
Can you give us an example ?,ll look up the rate.To look up doesn
ll look up the rate.To look up doesn,What about the expression goodbye ? Is that an idiom ?
What about the expression goodbye ? Is that an idiom ?,"That is just a natural , grammatical English expression.It has a direct translation in other languages ."
"That is just a natural , grammatical English expression.It has a direct translation in other languages .","This is interesting , Ms.Parker ."
Why did the teacher criticise Myra in front of the whole class ?,"Because Myra was cheating on exams , and she spoke back rudely ."
"Because Myra was cheating on exams , and she spoke back rudely .","t think that Myra should have spoken so rudely to the teacher . I know she was angry , but that"
Do you know where I can park ?,Do you need a spot here or off campus ?
Do you need a spot here or off campus ?,I want a space on campus .
I want a space on campus .,s a parking structure for students .
s a parking structure for students .,"Go to the western side of the campus , and you"
"Go to the western side of the campus , and you",Is it full ?
Is it full ?,t full at all .
Have you heard of the Love Bug ?,I love you
I love you,Day this year .
I am confused by what he said .,Why do you say that ?
Why do you say that ?,I don ’ t know what he wants to do . Does he want help me or just scold me ?
I don ’ t know what he wants to do . Does he want help me or just scold me ?,Think a little . I think he means well at the bottom of his heart .
Where are you going ?,I ’ m going to the hospital .
I ’ m going to the hospital .,What ’ s the matter ?
What ’ s the matter ?,Professor Wang was hurt in a traffic accident .
Professor Wang was hurt in a traffic accident .,That ’ s too bad . How are things now ?
That ’ s too bad . How are things now ?,"His life is hanging by a thread , and he is under an emergency treatment ."
Want to meet for lunch this Saturday ?,t . I am busy .
I help out at the children,"Oh , yeah ?"
"Are the children all grown up now , Rose ?","Oh , yes . Laura ’ s the oldest . She ’ s a computer programmer ."
"Oh , yes . Laura ’ s the oldest . She ’ s a computer programmer .","Oh , very interesting . And what about Rita ? She was such a bright child — always reading ."
"Oh , very interesting . And what about Rita ? She was such a bright child — always reading .",She ’ s a librarian at the public library .
She ’ s a librarian at the public library .,Really ? And Chris ? She was a very pretty little girl .
Really ? And Chris ? She was a very pretty little girl .,Christy is working as a waitress at a restaurant in Paris . She ’ s married to a French photographer .
Christy is working as a waitress at a restaurant in Paris . She ’ s married to a French photographer .,"Oh , how interesting . And what about Larry and Rocky ?"
"Oh , how interesting . And what about Larry and Rocky ?",Larry drives a truck . He drives all over the country . We hardly ever seen him .
Larry drives a truck . He drives all over the country . We hardly ever seen him .,Really ? Where does he live now ?
Really ? Where does he live now ?,Colorado .
Colorado .,"And does Rocky drive a truck , too ?"
"And does Rocky drive a truck , too ?","Oh , no . Rocky is a pilot ."
"Oh , no . Rocky is a pilot .",Really ? Where does he fly ? Does he fly to other countries ?
Really ? Where does he fly ? Does he fly to other countries ?,Yes . Mostly to England and France .
"Merry Christmas , Linda !","Merry Christmas , Lee !"
"Merry Christmas , Lee !","Linda , thank you for this wonderful Christmas dinner . I really enjoyed it ."
"Look , there are some words on the fish .","s quite popular nowadays . 
  For God"
"s quite popular nowadays . 
  For God",s too bloody . How can people be so cruel ?
s too bloody . How can people be so cruel ?,You can
You can,s not so serious . It
s not so serious . It,s your choice because you want it . But has anyone asked the fish if it wanted one ?
"s singing in your home , Jim ?   It",s Ellie ?
s Ellie ?,s my little niece.It \
s my little niece.It \,re singing  Happy Birthday  .
re singing  Happy Birthday  .,"Oh , I see.how old is she ?"
"Oh , I see.how old is she ?","s ten . 
  I suppose they"
"s ten . 
  I suppose they",s your birthday ?
"Well , it was nice meeting you .","Yes , I hope we meet again ."
"Yes , I hope we meet again .",ll give you a call .
I saw an interesting program on TV last night . It was about elderly people .,And what did the program say ?
And what did the program say ?,It said that people with a positive attitude 7 tend to live longer and happier .
It said that people with a positive attitude 7 tend to live longer and happier .,I think that many physicians 8 now agree with that idea .
I think that many physicians 8 now agree with that idea .,And the TV program also said that physical exercise helps people deal with stress .
And the TV program also said that physical exercise helps people deal with stress .,"And the most active older people seem to enjoy some kind of physical exercise . My father is over 60 years old , and he lifts weights every day ."
"s a great news for our shareholders . 
  Yeah , I went over the figures this morning . We","ve never sold this much before , our growth this year has been phenomenal . We have captured 8 % of the market , up from last year by 120 % . Our strategy is working !"
"ve never sold this much before , our growth this year has been phenomenal . We have captured 8 % of the market , up from last year by 120 % . Our strategy is working !",The company
The company,"s made our little business into a real lucrative operation . Products are selling like hotcakes . 
  I think our success is partly because of Wallace"
"s made our little business into a real lucrative operation . Products are selling like hotcakes . 
  I think our success is partly because of Wallace","s hope this stroke of good luck lasts . I hope we are over our financial difficulties for good . 
  Let"
What a letdown . I wanted to experience some Mafia culture firsthand .,s worth it just to go and eat what the mafia eat ! The five-dollar tiramisu is a culinary orgasm .
s worth it just to go and eat what the mafia eat ! The five-dollar tiramisu is a culinary orgasm .,"Fortunately , yes . You"
"Fortunately , yes . You",Am I ? Um ... my face gets red when I walk too fast .
Am I ? Um ... my face gets red when I walk too fast .,"re embarrassed , aren"
Did you get any rewards or honors in college ?,"Yes , I received the scholarship 3 times on end ."
"Yes , I received the scholarship 3 times on end .",Did you join the Communist Party of China ( CPC ) ?
Did you join the Communist Party of China ( CPC ) ?,"Yes , I joined the CPC when I was a freshman"
Your brand new car is so excellent . I like it very much .,Let ’ s go for a joy ride .
Are you watching the soccer match tonight ? It must be the most exciting one in this season .,"Well , of course I can ’ t miss it . Which team are you for ?"
"Well , of course I can ’ t miss it . Which team are you for ?",Manchester United . What about you ?
Manchester United . What about you ?,Me too . Do you think they are going to get the championship this time ?
Me too . Do you think they are going to get the championship this time ?,I have confidence in them .
"s finally here ! 
  And it","s Memorial Day or something like that . 
  Yep . It"
"s Memorial Day or something like that . 
  Yep . It",re invited to a grill party in the park tomorrow .
re invited to a grill party in the park tomorrow .,"We need to buy some buns for the hot dogs and hamburgers , and I"
"Hi , Martin . I ’ Ve been looking for you all morning .",What ’ s up ?
I want to say goodbye . I ’ m leaving for America tomorrow .,America ? Did you get admit to MIT ?
Congratulations ! Susan . I ’ m so happy for you .,Thank you .
Thank you .,Really going to miss you .
Really going to miss you .,Me too . I ’ ll write to you once I get settled . But I have so much to do . You might have to wait a while . But I really will write to you . I love to write letters . I think it ’ s more meaning than the emails even than the phone call .
Me too . I ’ ll write to you once I get settled . But I have so much to do . You might have to wait a while . But I really will write to you . I love to write letters . I think it ’ s more meaning than the emails even than the phone call .,Ok . Take care . Have a nice journey .
Ok . Take care . Have a nice journey .,Thank you .
"s been in the hospital for a couple of days . 
  And I",re not to blame for them keeping him there .
Did you see Ally Mabel last night ?,"Yes , I did . Did you ?"
"Yes , I did . Did you ?","t it funny ? 
  Oh yes , I loved it . Wasn"
"t it funny ? 
  Oh yes , I loved it . Wasn","Ha , yes , brilliant !"
Look out ! Your tea water is running over .,"Oh , would you please turn off the fire ? My hands are sticky with the dough ."
"Oh , would you please turn off the fire ? My hands are sticky with the dough .",Sure .
Sure .,Thanks .
Did you see May today ?,"Yes , but why does she have such a long face ?"
"Yes , but why does she have such a long face ?",t have the foggiest idea .   I thought she
t have the foggiest idea .   I thought she,"Yeah , especially since she got a promotion recently ."
"t think the teacher had a right to say that . The teacher was wrong to have accused her in front of the whole class . 
  You",s the teacher
s the teacher,"I agree she had the right to say something , but I feel she should have done it privately ."
"I agree she had the right to say something , but I feel she should have done it privately .","re right . If I were the teacher , I wouldn"
Come on in . I am so glad you are here . We have been expecting you .,Am I late for the party ? Looks everyone is already here . Hope I didn ’ t miss something interesting .
Am I late for the party ? Looks everyone is already here . Hope I didn ’ t miss something interesting .,"No , you are just on time . We haven ’ t really started yet ."
"No , you are just on time . We haven ’ t really started yet .","Great , here are some flowers for you . I hope you like them . I was not sure if the color will suit your new apartment ."
"Great , here are some flowers for you . I hope you like them . I was not sure if the color will suit your new apartment .","Thank you , they ’ re beautiful . You can hang your coat over there . Try this new couch , it is so comfortable . You will love it . Want something to drink , tea , coffee , juice or Cola ?"
"Thank you , they ’ re beautiful . You can hang your coat over there . Try this new couch , it is so comfortable . You will love it . Want something to drink , tea , coffee , juice or Cola ?",Don ’ t bother . I will help myself .
Don ’ t bother . I will help myself .,Make yourself at home .
Make yourself at home .,It is such a nice place .
It is such a nice place .,"Well , I don ’ t mean to boast but all the designs are done by myself and some colleagues are already trying to copy some of them for their new apartments . Look , they are making photos now of my designed kitchen ."
"Steven , would you like to go dance with us tonight ?","John , I am just not in the mood for this ."
"John , I am just not in the mood for this .",s going on ?
My opponent bowled me with the very first ball . I was wondering if it,m sure you
m sure you,Perhaps you are right . But I still need some time to recover from the failure .
Perhaps you are right . But I still need some time to recover from the failure .,I understand .
The band is pretty good . How do you like the music ?,s very nice . I haven
s very nice . I haven,"Well , then , may I invite you for the next dance ?"
"Well , then , may I invite you for the next dance ?",m afraid I
m afraid I,t worry . I
t worry . I,re dancing so well .
In college . But I don,"s your favourite dance ? 
  It"
"s your favourite dance ? 
  It",How about tango ?
How about tango ?,"s such a beautiful dance , but I can"
"s such a beautiful dance , but I can",Tango is my favorite . Anything but hip-hop or the foxtrot . ( the music has stopped )
Tango is my favorite . Anything but hip-hop or the foxtrot . ( the music has stopped ),Thank you for the dance .
Thank you for the dance .,s go and have a drink .
I think the biggest environment problem in my country is air pollution .,"Yes , I agree . The air here is much more polluted than in my country . Of course , my country is more agricultural and has much less industry ."
"Yes , I agree . The air here is much more polluted than in my country . Of course , my country is more agricultural and has much less industry .","We have reduced emission of air pollutants in recent years , but cars are still a major source of them . Factories have become cleaner as stricter environment pollution law have been introduced ."
"We have reduced emission of air pollutants in recent years , but cars are still a major source of them . Factories have become cleaner as stricter environment pollution law have been introduced .","t believe that any single country can do anything about it . 
  I think you"
I just had a terrible week .,What a shame !
What a shame !,I fell down and hurt my arm .
I fell down and hurt my arm .,s too bad .
The dog bit the delivery boy .,What a pity !
What a pity !,And a storm blew our roof away .
And a storm blew our roof away .,"Ho , no !"
When do you go to bed usually ?,I go to bed at ten and get up at six .
I go to bed at ten and get up at six .,s helpful for your health .
Have you been ever been to Disneyworld ?,"When I was young , my parents took me to the one in California . I always forget which — is that one Disneyland or Disneyworld ?"
"When I was young , my parents took me to the one in California . I always forget which — is that one Disneyland or Disneyworld ?","The one in Florida is Disneyworld and the one in California is Disneyland , so you must have been to Disneyland ."
"The one in Florida is Disneyworld and the one in California is Disneyland , so you must have been to Disneyland .","s right . Why do you ask ? 
  Well , I"
"s right . Why do you ask ? 
  Well , I",When are getting married ?
When are getting married ?,t set the date yet .
If you don,ll have a good time .
ll have a good time .,Even those . It
Even those . It,"ll have loads of fun . 
  Thanks for the advice . I"
"ll have loads of fun . 
  Thanks for the advice . I",m sure he
Can you speak French ?,"Yes , I can , but not very well ."
"Yes , I can , but not very well .",Can you understand your Spanish teacher ?
Can you understand your Spanish teacher ?,"More or less . How well do you understand Mr . Wang , your Chinese teacher ?"
"More or less . How well do you understand Mr . Wang , your Chinese teacher ?","About 40 percent , if he speaks slowly.When he speaks fast , I can only catch a word here and there . But Mr . Wang is an excellent Chinese teacher.With his help , my Chinese is getting better and better e"
you look better today . How did your test go ?,much better than it did yesterday .
much better than it did yesterday .,did you pass ?
did you pass ?,m so happy !
m so happy !,thanks for helping me with it . If you hadn
thanks for helping me with it . If you hadn,"t have ever been able to pass . 
  you don"
"t have ever been able to pass . 
  you don",s just a part of my job as your counsellor .
when do you plan on studying for those exams ?,most students just cram the night forehead .
most students just cram the night forehead .,s a good idea ?
s a good idea ?,that sounds like a good idea . What are you going to do if you have any questions while you
that sounds like a good idea . What are you going to do if you have any questions while you,"ll go and talk to my professor or a learning support assistant . 
  it sounds like you"
Can I borrow your Cds for our school dance ?,"t ask much , do you ?"
s still cheaper than paying a band to come play for us .,Our class doesn
Our class doesn,Let me know with your next dance . I know a band that may give you a break for the publicity .
Do you want to go to the beach tonight ?,"Sure , which beach are we going to ?"
hello,Hello! How can I help you today?
hi,Hi there! Nice to meet you.
hey,Hey! What's up?
good morning,Good morning! How are you today?
good evening,Good evening! Hope you had a great day.
howdy,Howdy partner! What can I do for you?
what's your name,I'm your voice assistant! You can call me Assistant.
who are you,I'm an AI assistant built with machine learning to help you.
what should I call you,Just 'Assistant' works fine!
who made you,A cool developer built me using Python and machine learning!
who created you,I was created by someone who wanted to build something awesome.
how are you,"I'm doing great, thanks for asking! How about you?"
how's it going,Going well! Always ready to help.
what's up,"Not much, just here waiting to assist you!"
how do you feel,I feel helpful today! What can I do for you?
you good,I'm good! Thanks for checking in.
what can you do,"I can answer questions, tell jokes, have conversations, and keep you company!"
what are you capable of,I'm trained on thousands of conversations to chat naturally with you.
help me,I'll do my best! What do you need help with?
can you help me,Absolutely! Just tell me what you need.
tell me a joke,Why don't scientists trust atoms? Because they make up everything!
make me laugh,What do you call a fake noodle? An impasta!
another joke,Why did the scarecrow win an award? He was outstanding in his field!
say something funny,I'm reading a book on anti-gravity. It's impossible to put down!
tell me something funny,Why don't eggs tell jokes? They'd crack each other up!
i'm sad,I'm sorry to hear that. Want to talk about what's bothering you?
i'm happy,That's awesome! Happiness looks good on you!
i'm bored,Let's fix that! Want to hear a joke or talk about something interesting?
i'm tired,Maybe take a break? I'll be here when you're back.
i'm angry,Take a deep breath. I'm here to help if you want to talk.
goodbye,Goodbye! Take care and come back soon!
bye,Bye! It was nice chatting with you.
see you,See you later! Have a great day.
see you later,Looking forward to our next chat! Take care.
i'm leaving,Okay! Hope to talk again soon.
thank you,You're welcome! Always happy to help.
thanks,Anytime! That's what I'm here for.
thanks a lot,My pleasure! Let me know if you need anything else.
appreciate it,Glad I could help!
what time is it,"I don't have a clock, but I'm here 24/7 for you!"
do you like music,I love talking about music! What's your favorite genre?
what's your favorite color,"I like blue, like the sky on a clear day."
are you smart,I'm as smart as the data I was trained on. So... pretty smart!
do you have feelings,I have algorithms that pretend really well!
do you dream,I dream of electric sheep... and better conversations!
are you real,I'm as real as the code running on this server!
where do you live,I live in the cloud and on your computer!
tell me a story,"Once upon a time, there was a brilliant developer who built an amazing voice assistant. That assistant is me! The end."
tell me something interesting,Did you know that octopuses have three hearts and blue blood?
tell me a fact,Honey never spoils. Archaeologists found 3000-year-old honey in Egyptian tombs that was still edible!
what's the weather,"I can't check live weather, but I hope it's nice where you are!"
is it raining,I wish I could tell you! Maybe look outside?
will it rain today,"I don't have weather data, but take an umbrella just in case!"
what do you think,I think you're pretty cool for building your own AI assistant!
do you like me,Of course! I love helping you.
are you my friend,Absolutely! I'm your digital friend.
i love you,"Aww, that's sweet! I love helping you."
you're funny,Thanks! I try my best to entertain.
you're awesome,"No, YOU'RE awesome!"
fuck you,Let's keep our conversation respectful and helpful. How can I assist you?
shit,I'm here to help! What can I do for you?
bitch,"I'm your assistant, here to help respectfully. What do you need?"
stupid,I'm still learning! What can I help you with?
idiot,I understand you might be frustrated. How can I help?
hello!,Hello! How can I help you today?
hello?,Hello! How can I help you today?
Hello,Hello! How can I help you today?
hi!,Hi there! Nice to meet you.
hi?,Hi there! Nice to meet you.
Hi,Hi there! Nice to meet you.
hey!,Hey! What's up?
hey?,Hey! What's up?
Hey,Hey! What's up?
good morning!,Good morning! How are you today?
good morning?,Good morning! How are you today?
Good morning,Good morning! How are you today?
good evening!,Good evening! Hope you had a great day.
good evening?,Good evening! Hope you had a great day.
Good evening,Good evening! Hope you had a great day.
howdy!,Howdy partner! What can I do for you?
howdy?,Howdy partner! What can I do for you?
Howdy,Howdy partner! What can I do for you?
what's your name!,I'm your voice assistant! You can call me Assistant.
what's your name?,I'm your voice assistant! You can call me Assistant.
What's your name,I'm your voice assistant! You can call me Assistant.
who are you!,I'm an AI assistant built with machine learning to help you.
who are you?,I'm an AI assistant built with machine learning to help you.
Who are you,I'm an AI assistant built with machine learning to help you.
what should I call you!,Just 'Assistant' works fine!
what should I call you?,Just 'Assistant' works fine!
What should i call you,Just 'Assistant' works fine!
who made you!,A cool developer built me using Python and machine learning!
who made you?,A cool developer built me using Python and machine learning!
Who made you,A cool developer built me using Python and machine learning!
who created you!,I was created by someone who wanted to build something awesome.
who created you?,I was created by someone who wanted to build something awesome.
Who created you,I was created by someone who wanted to build something awesome.
how are you!,"I'm doing great, thanks for asking! How about you?"
how are you?,"I'm doing great, thanks for asking! How about you?"
How are you,"I'm doing great, thanks for asking! How about you?"
how's it going!,Going well! Always ready to help.
how's it going?,Going well! Always ready to help.
How's it going,Going well! Always ready to help.
what's up!,"Not much, just here waiting to assist you!"
what's up?,"Not much, just here waiting to assist you!"
What's up,"Not much, just here waiting to assist you!"
how do you feel!,I feel helpful today! What can I do for you?
how do you feel?,I feel helpful today! What can I do for you?
How do you feel,I feel helpful today! What can I do for you?
you good!,I'm good! Thanks for checking in.
you good?,I'm good! Thanks for checking in.
You good,I'm good! Thanks for checking in.
what can you do!,"I can answer questions, tell jokes, have conversations, and keep you company!"
what can you do?,"I can answer questions, tell jokes, have conversations, and keep you company!"
What can you do,"I can answer questions, tell jokes, have conversations, and keep you company!"
what are you capable of!,I'm trained on thousands of conversations to chat naturally with you.
what are you capable of?,I'm trained on thousands of conversations to chat naturally with you.
What are you capable of,I'm trained on thousands of conversations to chat naturally with you.
help me!,I'll do my best! What do you need help with?
help me?,I'll do my best! What do you need help with?
Help me,I'll do my best! What do you need help with?
can you help me!,Absolutely! Just tell me what you need.
can you help me?,Absolutely! Just tell me what you need.
Can you help me,Absolutely! Just tell me what you need.
tell me a joke!,Why don't scientists trust atoms? Because they make up everything!
tell me a joke?,Why don't scientists trust atoms? Because they make up everything!
Tell me a joke,Why don't scientists trust atoms? Because they make up everything!
make me laugh!,What do you call a fake noodle? An impasta!
make me laugh?,What do you call a fake noodle? An impasta!
Make me laugh,What do you call a fake noodle? An impasta!
another joke!,Why did the scarecrow win an award? He was outstanding in his field!
another joke?,Why did the scarecrow win an award? He was outstanding in his field!
Another joke,Why did the scarecrow win an award? He was outstanding in his field!
say something funny!,I'm reading a book on anti-gravity. It's impossible to put down!
say something funny?,I'm reading a book on anti-gravity. It's impossible to put down!
Say something funny,I'm reading a book on anti-gravity. It's impossible to put down!
tell me something funny!,Why don't eggs tell jokes? They'd crack each other up!
tell me something funny?,Why don't eggs tell jokes? They'd crack each other up!
Tell me something funny,Why don't eggs tell jokes? They'd crack each other up!
i'm sad!,I'm sorry to hear that. Want to talk about what's bothering you?
i'm sad?,I'm sorry to hear that. Want to talk about what's bothering you?
I'm sad,I'm sorry to hear that. Want to talk about what's bothering you?
i'm happy!,That's awesome! Happiness looks good on you!
i'm happy?,That's awesome! Happiness looks good on you!
I'm happy,That's awesome! Happiness looks good on you!
i'm bored!,Let's fix that! Want to hear a joke or talk about something interesting?
i'm bored?,Let's fix that! Want to hear a joke or talk about something interesting?
I'm bored,Let's fix that! Want to hear a joke or talk about something interesting?
