user,assistant
"Say , Jim , how about going for a few beers after dinner ?",You know that is tempting but is really not good for our fitness .
You know that is tempting but is really not good for our fitness .,What do you mean ? It will help us to relax .
What do you mean ? It will help us to relax .,"t . It will just make us fat and act silly . Remember last time ? 
  I guess you are right.But what shall we do ? I don"
"t . It will just make us fat and act silly . Remember last time ? 
  I guess you are right.But what shall we do ? I don",I suggest a walk over to the gym where we can play singsong and meet some of our friends .
I suggest a walk over to the gym where we can play singsong and meet some of our friends .,s a good idea . I hear Mary and Sally often go there to play pingpong.Perhaps we can make a foursome with them .
s a good idea . I hear Mary and Sally often go there to play pingpong.Perhaps we can make a foursome with them .,Good.Let
Good.Let,All right .
Can you do push-ups ?,"s a piece of cake ! Believe it or not , I can do 30 push-ups a minute . 
  Really ? I think that"
"s a piece of cake ! Believe it or not , I can do 30 push-ups a minute . 
  Really ? I think that",You mean 30 push-ups ?
You mean 30 push-ups ?,Yeah !
Can you study with the radio on ?,"No , I listen to background music ."
"No , I listen to background music .",What is the difference ?
What is the difference ?,The radio has too many comerials .
Are you all right ?,I will be all right soon . I was terrified when I watched them fall from the wire .
I will be all right soon . I was terrified when I watched them fall from the wire .,t worry.He is an acrobat 。
"Hey John , nice skates . Are they new ?","Yeah , I just got them . I started playing ice hockey in a community league . So , I finally got myself new skates ."
"Yeah , I just got them . I started playing ice hockey in a community league . So , I finally got myself new skates .",What position do you play ?
What position do you play ?,I ’ m a defender . It ’ s a lot of fun . You don ’ t have to be able to skate as fast on defense .
I ’ m a defender . It ’ s a lot of fun . You don ’ t have to be able to skate as fast on defense .,"Yeah , you ’ re a pretty big guy . I play goalie , myself ."
"Yeah , you ’ re a pretty big guy . I play goalie , myself .","Oh , yeah ? Which team ?"
"Oh , yeah ? Which team ?",The Rockets .
The Rockets .,"Really ? I think we play you guys next week . Well , I have to go to practice . See you later ."
"Really ? I think we play you guys next week . Well , I have to go to practice . See you later .","All right , see you later ."
"Hey Lydia , what are you reading ?","I ’ m looking at my horoscope for this month ! My outlook is very positive . It says that I should take a vacation to someplace exotic , and that I will have a passionate summer fling !"
"I ’ m looking at my horoscope for this month ! My outlook is very positive . It says that I should take a vacation to someplace exotic , and that I will have a passionate summer fling !",What are you talking about ? Let me see that ... What are horoscopes ?
What are you talking about ? Let me see that ... What are horoscopes ?,"It ’ s a prediction of your month , based on your zodiac sign . You have a different sign for the month and date you were born in . I was born on April 15th , so I ’ m an Aries . When were you born ?"
"It ’ s a prediction of your month , based on your zodiac sign . You have a different sign for the month and date you were born in . I was born on April 15th , so I ’ m an Aries . When were you born ?",January 5th .
January 5th .,"Let ’ s see . . . you ’ re a Capricorn . It says that you will be feeling stress at work , but you could see new , exciting developments in your love life . Looks like we ’ ll both have interesting summers !"
"Let ’ s see . . . you ’ re a Capricorn . It says that you will be feeling stress at work , but you could see new , exciting developments in your love life . Looks like we ’ ll both have interesting summers !","t feel any stress at work , and my love life is practically nonexistent . This zodiac stuff is all a bunch of nonsense ."
"Frank ’ s getting married , do you believe this ?",Is he really ?
Is he really ?,"Yes , he is . He loves the girl very much ."
"Yes , he is . He loves the girl very much .",Who is he marring ?
Who is he marring ?,"A girl he met on holiday in Spain , I think ."
"A girl he met on holiday in Spain , I think .",Have they set a date for the wedding ?
Have they set a date for the wedding ?,Not yet .
I hear you bought a new house in the northern suburbs .,"That ’ s right , we bought it the same day we came on the market ."
"That ’ s right , we bought it the same day we came on the market .",What kind of house is it ?
What kind of house is it ?,It ’ s a wonderful Spanish style .
It ’ s a wonderful Spanish style .,"Oh , I love the roof tiles on Spanish style houses ."
"Oh , I love the roof tiles on Spanish style houses .",And it ’ s a bargaining . A house like this in river side costs double the price .
And it ’ s a bargaining . A house like this in river side costs double the price .,"Great , is it a two bedroom house ?"
"Great , is it a two bedroom house ?","No , it has three bedrooms and three beds , and has a living room with a twelve-foot ceiling . There ’ s a two-car garage ."
"No , it has three bedrooms and three beds , and has a living room with a twelve-foot ceiling . There ’ s a two-car garage .",That ’ s a nice area too . It ’ ll be a good investment for you .
That ’ s a nice area too . It ’ ll be a good investment for you .,"Yeas , when will you buy a house ?"
"Yeas , when will you buy a house ?","Not untill the end of this year , you know , just before my wedding ."
"Not untill the end of this year , you know , just before my wedding .","Right , congratulations ."
"Right , congratulations .",Thank you .
s around .,"Well , last week I invited her over to dinner . My husband and I had no problem with the food , but if you listened to her , then it would seem like I fed her old meat and rotten vegetables . There"
"Well , last week I invited her over to dinner . My husband and I had no problem with the food , but if you listened to her , then it would seem like I fed her old meat and rotten vegetables . There",t see that happening . I know you
t see that happening . I know you,"s not just that . She also criticizes how we raise the kids . 
  My mother-in-law used to do the same thing to us . If it wasn"
"s not just that . She also criticizes how we raise the kids . 
  My mother-in-law used to do the same thing to us . If it wasn",You said she used to ? How did you stop her ?
You said she used to ? How did you stop her ?,"d let us do our things . She understood , and now everything is a lot more peaceful . 
  That sounds like a good idea . I"
"s new programmers working out ? 
  I hate to admit it , but they","ll make the Stars.com deadline , and have us up and running next week ? 
  It"
"ll make the Stars.com deadline , and have us up and running next week ? 
  It","ll make it . 
  Good . After Stars.com starts paying us , we won"
"ll make it . 
  Good . After Stars.com starts paying us , we won","s cash anymore . 
  And if we don"
Do you like cooking ?,Yes . I like cooking very much . I got this hobby when I was 12 years sold .
Yes . I like cooking very much . I got this hobby when I was 12 years sold .,Why do you like it ?
Why do you like it ?,I have no idea . I like cooking by myself . I like to taste delicious food .
I have no idea . I like cooking by myself . I like to taste delicious food .,s wonderful !
s wonderful !,Really ? I hope I can have a chance to taste it . Don
Really ? I hope I can have a chance to taste it . Don,Certainly .
Anyone home ? Jen !,"m in the kitchen ... let yourself in ! 
  Wow ! You"
"m in the kitchen ... let yourself in ! 
  Wow ! You",ve even worked up a sweat .
You look so tan and healthy !,Thanks . I just got back from summer camp .
Thanks . I just got back from summer camp .,How was it ?
How was it ?,Great . I got to try so many things for the first time .
Great . I got to try so many things for the first time .,Like what ?
Like what ?,"I went sailing , fishing , and horseback riding ."
"I went sailing , fishing , and horseback riding .",I ’ m so jealous .
I ’ m so jealous .,The counselors were so nice too . It was the best summer ever . Except for all those mosquitoes !
"Diana , do you like the perfume I gave you ?","It ’ s good . But to tell you the truth , I don ’ t wear perfume ."
"It ’ s good . But to tell you the truth , I don ’ t wear perfume .",I ’ m sorry . I didn ’ t know that .
I ’ m sorry . I didn ’ t know that .,That ’ s all right . Thank you all the same .
"Ah , ah , ah ...",s your daily exercise schedule . You are to jog before breakfast .
"OK , you can stop now.It",t know how .
"Hi Bill , I saw your grandma yesterday .",Oh where was that ?
Oh where was that ?,I was running around the track at my college and there she was walking around the same track .
I was running around the track at my college and there she was walking around the same track .,Grannie always tries to stay fit and healthy.She is always making us kids eat the proper foods .
Grannie always tries to stay fit and healthy.She is always making us kids eat the proper foods .,"Well , it pays off for her.How old is she anyway ?"
"Well , it pays off for her.How old is she anyway ?",She will be 86 next month .
She will be 86 next month .,That is truly amazing !
I would like to register for a class today .,"No problem , what class would you like to take ?"
"No problem , what class would you like to take ?",m crazy .
"Dad , why are you taping the windows ?","Honey , a typhoon is coming ."
"Honey , a typhoon is coming .",t have to go to school tomorrow .
t have to go to school tomorrow .,OK . Dad ! I
"m from Russia . 
  Nice to meet you , Lean . My name is Alike . I",To me English is a difficult language .
To me English is a difficult language .,A second language is always difficult .
A second language is always difficult .,s a crazy language .
Can I help you ?,m looking for some material for a paper I
m looking for some material for a paper I,"m not quite sure where to look . 
  I"
"m not quite sure where to look . 
  I",My paper is on the influence of television on children .
My paper is on the influence of television on children .,There are several possible sources you might use for that topic . I suggest you use the computer and the computer will give you a list of every scientific journal that talks about children and television .
There are several possible sources you might use for that topic . I suggest you use the computer and the computer will give you a list of every scientific journal that talks about children and television .,Thank you for you help .
Here ’ s your hot dog and beer . What happened ? Did I miss anything ?,"Yeah , Cal Ripen just hit a home run ."
"Yeah , Cal Ripen just hit a home run .",What ’ s the score ?
What ’ s the score ?,"Well it was 3 to 4 , but Ripen ’ s home run made it 5 to 4 since another player was on first base ."
"Well it was 3 to 4 , but Ripen ’ s home run made it 5 to 4 since another player was on first base .",So Baltimore is winning ?
So Baltimore is winning ?,Right .
Right .,This is a really great place to watch a baseball game .
This is a really great place to watch a baseball game .,"Yeah , there isn ’ t a bad seat in the place ."
"Yeah , there isn ’ t a bad seat in the place .","The fans are great here , too . Not like in Philadelphia ."
"The fans are great here , too . Not like in Philadelphia .",It was a great idea to spend a day watching a game .
It was a great idea to spend a day watching a game .,"Yeah , it reminds you why they say baseball is America ’ s favorite pastime ."
How do you like the pizza here ?,Perfect . It really hits the spot .
I was scared stiff of giving my first performance .,Were you ? your performance was excellent .
Were you ? your performance was excellent .,Thank you for your kindly words .
Excuse me . Could you please take a picture of us with this camera ?,Sure . Which button do I press to shoot ?
Sure . Which button do I press to shoot ?,This one .
This one .,Do I have to focus it ?
Do I have to focus it ?,"No , this is a focus-free camera . All you have to do is point and press the button ."
"No , this is a focus-free camera . All you have to do is point and press the button .",All right . Say cheese !
Every country should face the history .,"Yeah , we don ’ t live in the vacuum . We have traditional values and long but different history ."
"Yeah , we don ’ t live in the vacuum . We have traditional values and long but different history .","Sometimes , we , human beings , really had done something wrong , so we should admit it at first ."
"Sometimes , we , human beings , really had done something wrong , so we should admit it at first .",But there is always somebody who wants to turn his back on the true history .
But there is always somebody who wants to turn his back on the true history .,"I believe such things won ’ t be realized , just daydreaming ."
"Do you like traveling , Kathy ?","I like traveling for pleasure to get places for vacation for instance . But I don ’ t like traveling to work , waiting for buses , or ..."
"I like traveling for pleasure to get places for vacation for instance . But I don ’ t like traveling to work , waiting for buses , or ...",Or getting stuck in traffic jams when you ’ re driving .
Or getting stuck in traffic jams when you ’ re driving .,Exactly .
Your house is too small . Why not buy a big one .,I do wish I could afford one .
I do wish I could afford one .,You can get a loan from the bank . You know LPF program provides low cost loans for participants home purchases .
"How do you do , Prof.Smith .","How do you do , Ms . Yang.You speak very good English ."
"How do you do , Ms . Yang.You speak very good English .",Thank you . I begin to like English even when I was a child .
Thank you . I begin to like English even when I was a child .,Where did you learn it ?
Where did you learn it ?,"At school , in China.This is my first time to be out of my own country ."
Do you want black or white coffee ?,"White , please"
"White , please","s a Folk concert tomorrow evening . Do you Want to go ? 
  I don"
"s a Folk concert tomorrow evening . Do you Want to go ? 
  I don",What kind of music do you like ?
What kind of music do you like ?,I like classical music . Do you ?
I like classical music . Do you ?,Not very much . Classical music sends me to sleep
Not very much . Classical music sends me to sleep,t believe you .
What do you like to do in your spare time ?,I like playing chess .
I like playing chess .,Do you have any hobbies besides playing chess ?
Do you have any hobbies besides playing chess ?,m afraid not .
"t find him anywhere . 
  Haven",What ? Beg your pardon .
What ? Beg your pardon .,John is in prison now . He was copped outstealing .
"Hey , Ted . What are you up to this Friday ?","Well , I have the day off from work ."
"Well , I have the day off from work .",That ’ s great ! Do you have any plans ?
That ’ s great ! Do you have any plans ?,"Well , I ’ Ve been working so hard lately , so I ’ ll probably just take it easy ."
"Well , I ’ Ve been working so hard lately , so I ’ ll probably just take it easy .",Sounds nice .
Sounds nice .,"Yeah , I ’ ll probably just stay in and relax . Maybe watch a few movies ."
"Yeah , I ’ ll probably just stay in and relax . Maybe watch a few movies .",Can I stop by ?
Can I stop by ?,Sure . Any time .
You honestly believe the world ’ s improving every year ?,"Yes , I do . I think that science is making us wiser . What do you think ?"
"Yes , I do . I think that science is making us wiser . What do you think ?",I don ’ t think you ’ re right there .
I don ’ t think you ’ re right there .,I believe industry is making us wealthier .
I believe industry is making us wealthier .,I don ’ t believe that .
I don ’ t believe that .,"And in my opinion , medicine is making us healthier ."
"And in my opinion , medicine is making us healthier .","I agree with you in the sense . But we ’ re all more miserable than ever , aren ’ t we ?"
"I agree with you in the sense . But we ’ re all more miserable than ever , aren ’ t we ?","I don ’ t agree with you . I maintain that we ’ re healthier , wealthier and wiser than we were a hundred years ago ."
"I don ’ t agree with you . I maintain that we ’ re healthier , wealthier and wiser than we were a hundred years ago .",That ’ s your opinion not mine .
What do you plan to do for your birthday ?,"I want to have a picnic with my friends , Mum ."
"I want to have a picnic with my friends , Mum .",How about a party at home ? That way we can get together and celebrate it .
How may I help you ?,I would like to return this book .
I would like to return this book .,Is that all you need ?
Is that all you need ?,I also want to check out this video .
I also want to check out this video .,Is that all you would like to check out ?
Is that all you would like to check out ?,That ’ s all I need .
That ’ s all I need .,Do you have your library card ?
Do you have your library card ?,Here it is .
Here it is .,Make sure to take proper care of this video .
Make sure to take proper care of this video .,That won ’ t be a problem .
That won ’ t be a problem .,"If you damage the video , you will be fined ."
"If you damage the video , you will be fined .",I won ’ t damage it .
s the matter with you then ? You look miserable .   It,What do you mean by us .
What do you mean by us .,"re busy . 
  That"
"re busy . 
  That",And you often go back to live with your parents and leave our son in the room by himself .
And you often go back to live with your parents and leave our son in the room by himself .,"I ... I ... I miss my parents , also they miss me ."
"I ... I ... I miss my parents , also they miss me .",t say anything about it .
t say anything about it .,Totally not . Perhaps it
"s the matter with you ? 
  I think I","m aching all over . 
  You"
"m aching all over . 
  You",ll be yourself pretty soon .
"Could you tell me the right time , please ?",Well . My watch says five past two . But it ’ s no use rely on it because it has been gaining and losing these last a few days .
Well . My watch says five past two . But it ’ s no use rely on it because it has been gaining and losing these last a few days .,You have to go and fix it .
You have to go and fix it .,Yes . I will .
does your family have a record of your ancestors ?,sure . My mom has been working on our family tree for years . She ’ s always updating it .
sure . My mom has been working on our family tree for years . She ’ s always updating it .,do you have a copy of your family tree in your house ? I ’ d love to see it .
do you have a copy of your family tree in your house ? I ’ d love to see it .,"I can show it to you now , if you like . I think it goes back about 8 generations so far ."
"I can show it to you now , if you like . I think it goes back about 8 generations so far .",that ’ s amazing . Do you have a large extended family ?
that ’ s amazing . Do you have a large extended family ?,I ’ Ve got 30 cousins on my mom ’ s side and 10 cousins on my dad ’ s side .
I ’ Ve got 30 cousins on my mom ’ s side and 10 cousins on my dad ’ s side .,are you very close to your first-cousins ?
are you very close to your first-cousins ?,"the ones that are my age are close relatives . Now that I ’ m older , I don ’ t spend as much time with them as I used to , so I don ’ t know my younger cousins as well as the older ones ."
"the ones that are my age are close relatives . Now that I ’ m older , I don ’ t spend as much time with them as I used to , so I don ’ t know my younger cousins as well as the older ones .",I see . who ’ s the head of your household ?
I see . who ’ s the head of your household ?,"it ’ s definitely my mother . And , her mother is definitely the matriarch of the bigger family ."
"it ’ s definitely my mother . And , her mother is definitely the matriarch of the bigger family .",that ’ s interesting . What does your grandfather think of your step-mother ?
that ’ s interesting . What does your grandfather think of your step-mother ?,"at first , she was quite critical of her , but now that they ’ Ve been married for a few years , she ’ s starting to accept the fact that my father divorced my mother ."
"at first , she was quite critical of her , but now that they ’ Ve been married for a few years , she ’ s starting to accept the fact that my father divorced my mother .","that ’ s pretty much how you feel about your step-mother . Like grandmother , like grandson ."
"Hi , Mr . Wang . Do you feel like going boating with me ?","t gone boating for some time now , and what time ?"
"ve been to the Saikei Ski Resort for the weekend . Did you enjoy it ? 
  Yes , it",t there any coach to teach you how to ski ?
You look pale recently .,Yeah . I have got much pressure in the company . I have tobe wrapped upon my work .
Yeah . I have got much pressure in the company . I have tobe wrapped upon my work .,Take good care of yourself .
Take good care of yourself .,Thank you . I will .
"Hey , Maggy , Did you hear about David ?","About David ? No , I didn ’ t hear anything ."
"About David ? No , I didn ’ t hear anything .","You know , about David and his new boss ."
"You know , about David and his new boss .","Sorry , I don ’ t quite follow you ."
"Sorry , I don ’ t quite follow you .","Well , I heard David has been fired ."
"Well , I heard David has been fired .","Oh , that is a shame . He is really hard working ."
how do you usually get to school ?,I usually ride my bike . Which form of transport do you prefer to use ?
I usually ride my bike . Which form of transport do you prefer to use ?,"I feel that I can see more when I pedal a bicycle , but when I feel lazy , I drive my car ."
"I feel that I can see more when I pedal a bicycle , but when I feel lazy , I drive my car .",I think we should discourage people from using their private cars . They produce too much pollution !
I think we should discourage people from using their private cars . They produce too much pollution !,"s just so convenient . 
  cars might be convenient , but they"
"s just so convenient . 
  cars might be convenient , but they",do you have a car ?
do you have a car ?,"t really need it . 
  maybe if I sold my car now , I wouldn"
"t really need it . 
  maybe if I sold my car now , I wouldn",you could try . It would save you a lot of money .
you could try . It would save you a lot of money .,"s true . Every month , I spend hundreds of dollars on gas , insurance , and repairs ."
"What are you going to do for one year abroad , Tom ?","Study , study , study . I want to learn a lot ."
"Study , study , study . I want to learn a lot .",You are going to take courses ?
You are going to take courses ?,Yes . I am going to take some university courses there .
Yes . I am going to take some university courses there .,Sounds hard .
Sounds hard .,s probably for the best .
s probably for the best .,"Hey , I am a pretty cool guy . I will make friends , and I"
"t this lovely weather ? Will you help me water the flowers , Jack ?",I do.We haven
I do.We haven,t you see the dark clouds ? It
t you see the dark clouds ? It,"t have to work.How nice ! 
  But I don"
"t have to work.How nice ! 
  But I don",s so nice .
s so nice .,The weather report says it
"On , darn . The grocery store is closed .","Yeah , this one closes at ten . We could drive to the 24 - hour store on sixth ."
"Yeah , this one closes at ten . We could drive to the 24 - hour store on sixth .",Alright . We are out of everything .
Alright . We are out of everything .,I wish the store close to us was open 24 - house a day .
I wish the store close to us was open 24 - house a day .,"I know , our schedules are so weird . Sometimes , the little corner store is the only thing within walking distance that ’ s open when we get home ."
"I know , our schedules are so weird . Sometimes , the little corner store is the only thing within walking distance that ’ s open when we get home .","Yeah , and the prices there are very high ."
"Yeah , and the prices there are very high .",I know . Three dollars for milk .
Do you think they two will get married ?,You can count on it .
You can count on it .,"I think so.Yes , they get along so well ."
"I think so.Yes , they get along so well .",s good for her .   You
"Dad , where are we off to ?",First we will go to the city centre and stop for something to drink . Then we will visit the University Museum .
First we will go to the city centre and stop for something to drink . Then we will visit the University Museum .,Where are we going to have a drink ?
Where are we going to have a drink ?,There is a coffee shop round the corner . Can you see that big building at the end of the road ?
That is a bank . The coffee shop is opposite the bank .,Good . I will have hot chocolate .
Good . I will have hot chocolate .,A stop ! Wait for the lights to turn green .
A stop ! Wait for the lights to turn green .,s around you .
How about going to the cinema tonight ?,s great . What
s great . What,s a romantic one .
I feel so uncomfortable .,Are you sick ?
Are you sick ?,No . The teacher is dragging the chalk over the blackboard . It set my teeth on edge .
No . The teacher is dragging the chalk over the blackboard . It set my teeth on edge .,He ’ ll finish writing in a minute .
I have made up my mind . I am getting a tattoo .,Really ? Are you sure ?
